{
  "$schema": "./production-signing-certificate.schema.json",
  "applicationId": "com.thedarkskyxd.streamfusion",
  "certificateSha256": null,
  "recordedBy": null,
  "recordedAt": null,
  "notes": "Null fingerprint means no production build is authorized. Android accepts an update only when the signing certificate matches, so an unpinned signer cannot be verified before publication. Populate certificateSha256 with the lowercase hex SHA-256 certificate fingerprint of the StreamFusion Mobile production signing key, never the keystore password. Record the same value in the Android Developer Console package registration."
}
